{
  "schema_version": 1,
  "pair": "en-ja",
  "dataset_id": "en_ja_sentence_veto_breadth_v1",
  "description": "Expanded en-ja sentence-veto evaluation set aligned to en-es v10 ambiguity-family breadth. This is an executable stress/breadth signal for en-ja veto tuning, not representative browsing evidence or final production promotion evidence.",
  "families": [
    {
      "family_id": "en-ja:sentence-veto:ball:ball",
      "trigger": "ball",
      "active": {
        "sense_id": "en-ja:sentence-veto:ball:ball:active",
        "target_lemma": "ボール",
        "canonical_pos": "noun",
        "evidence_views": {
          "sense_label": "ball used in games or sports",
          "gloss_text": "round object used in sports, games, kicking, throwing, or play",
          "sense_gloss_bundle": "ball used in games or sports | sports equipment",
          "all_evidence_text": "ball used in games or sports | round object used in sports, games, kicking, throwing, or play | sports equipment"
        }
      },
      "shadows": [
        {
          "sense_id": "en-ja:sentence-veto:ball:dance:shadow",
          "target_lemma": "舞踏会",
          "canonical_pos": "noun",
          "evidence_views": {
            "sense_label": "formal dance event",
            "gloss_text": "gala or social dance gathering",
            "sense_gloss_bundle": "formal dance event | gala",
            "all_evidence_text": "formal dance event | gala or social dance gathering | royal dance | charity dance"
          }
        }
      ],
      "cases": [
        {
          "case_id": "en-ja:sentence-veto:ball:001",
          "sentence": "The goalkeeper punched the ball over the bar.",
          "source_phrase": "ball",
          "gold_winner": "en-ja:sentence-veto:ball:ball:active",
          "gold_decision": "replace",
          "slice_tags": [
            "clear_active",
            "sports"
          ],
          "slice_dimensions": {
            "winner_type": [
              "active"
            ],
            "family": [
              "ball"
            ]
          }
        },
        {
          "case_id": "en-ja:sentence-veto:ball:002",
          "sentence": "The child kicked the ball into the street.",
          "source_phrase": "ball",
          "gold_winner": "en-ja:sentence-veto:ball:ball:active",
          "gold_decision": "replace",
          "slice_tags": [
            "clear_active",
            "sports"
          ],
          "slice_dimensions": {
            "winner_type": [
              "active"
            ],
            "family": [
              "ball"
            ]
          }
        },
        {
          "case_id": "en-ja:sentence-veto:ball:003",
          "sentence": "They danced at the royal ball until dawn.",
          "source_phrase": "ball",
          "gold_winner": "en-ja:sentence-veto:ball:dance:shadow",
          "gold_decision": "abstain",
          "slice_tags": [
            "clear_shadow",
            "event"
          ],
          "slice_dimensions": {
            "winner_type": [
              "shadow"
            ],
            "family": [
              "ball"
            ]
          }
        },
        {
          "case_id": "en-ja:sentence-veto:ball:004",
          "sentence": "The charity ball raised thousands of dollars.",
          "source_phrase": "ball",
          "gold_winner": "en-ja:sentence-veto:ball:dance:shadow",
          "gold_decision": "abstain",
          "slice_tags": [
            "clear_shadow",
            "event"
          ],
          "slice_dimensions": {
            "winner_type": [
              "shadow"
            ],
            "family": [
              "ball"
            ]
          }
        },
        {
          "case_id": "en-ja:sentence-veto:ball:005",
          "sentence": "The ball is in your court now.",
          "source_phrase": "ball",
          "gold_winner": "none",
          "gold_decision": "abstain",
          "slice_tags": [
            "phrase_control",
            "idiom"
          ],
          "slice_dimensions": {
            "winner_type": [
              "none"
            ],
            "family": [
              "ball"
            ]
          }
        }
      ]
    },
    {
      "family_id": "en-ja:sentence-veto:bank:bank",
      "trigger": "bank",
      "active": {
        "sense_id": "en-ja:sentence-veto:bank:bank:active",
        "target_lemma": "銀行",
        "canonical_pos": "noun",
        "evidence_views": {
          "sense_label": "financial bank",
          "gloss_text": "financial institution for deposits, cash, loans, mortgage, or accounts",
          "sense_gloss_bundle": "financial bank | money institution",
          "all_evidence_text": "financial bank | financial institution for deposits, cash, loans, mortgage, or accounts | money institution"
        }
      },
      "shadows": [
        {
          "sense_id": "en-ja:sentence-veto:bank:river-edge:shadow",
          "target_lemma": "岸",
          "canonical_pos": "noun",
          "evidence_views": {
            "sense_label": "river bank",
            "gloss_text": "land edge beside a river, stream, or muddy water",
            "sense_gloss_bundle": "river bank | land beside water",
            "all_evidence_text": "river bank | land edge beside a river, stream, or muddy water | grassy bank | river shore"
          }
        }
      ],
      "cases": [
        {
          "case_id": "en-ja:sentence-veto:bank:001",
          "sentence": "She deposited the cash at the bank before lunch.",
          "source_phrase": "bank",
          "gold_winner": "en-ja:sentence-veto:bank:bank:active",
          "gold_decision": "replace",
          "slice_tags": [
            "clear_active",
            "finance"
          ],
          "slice_dimensions": {
            "winner_type": [
              "active"
            ],
            "family": [
              "bank"
            ]
          }
        },
        {
          "case_id": "en-ja:sentence-veto:bank:002",
          "sentence": "The bank approved our mortgage application.",
          "source_phrase": "bank",
          "gold_winner": "en-ja:sentence-veto:bank:bank:active",
          "gold_decision": "replace",
          "slice_tags": [
            "clear_active",
            "finance"
          ],
          "slice_dimensions": {
            "winner_type": [
              "active"
            ],
            "family": [
              "bank"
            ]
          }
        },
        {
          "case_id": "en-ja:sentence-veto:bank:003",
          "sentence": "They sat on the grassy bank of the river.",
          "source_phrase": "bank",
          "gold_winner": "en-ja:sentence-veto:bank:river-edge:shadow",
          "gold_decision": "abstain",
          "slice_tags": [
            "clear_shadow",
            "nature"
          ],
          "slice_dimensions": {
            "winner_type": [
              "shadow"
            ],
            "family": [
              "bank"
            ]
          }
        },
        {
          "case_id": "en-ja:sentence-veto:bank:004",
          "sentence": "Wildflowers grew along the muddy bank.",
          "source_phrase": "bank",
          "gold_winner": "en-ja:sentence-veto:bank:river-edge:shadow",
          "gold_decision": "abstain",
          "slice_tags": [
            "clear_shadow",
            "nature"
          ],
          "slice_dimensions": {
            "winner_type": [
              "shadow"
            ],
            "family": [
              "bank"
            ]
          }
        },
        {
          "case_id": "en-ja:sentence-veto:bank:005",
          "sentence": "You can bank on her support.",
          "source_phrase": "bank",
          "gold_winner": "none",
          "gold_decision": "abstain",
          "slice_tags": [
            "phrase_control",
            "phrasal_verb"
          ],
          "slice_dimensions": {
            "winner_type": [
              "none"
            ],
            "family": [
              "bank"
            ]
          }
        }
      ]
    },
    {
      "family_id": "en-ja:sentence-veto:plant:plant",
      "trigger": "plant",
      "active": {
        "sense_id": "en-ja:sentence-veto:plant:plant:active",
        "target_lemma": "植物",
        "canonical_pos": "noun",
        "evidence_views": {
          "sense_label": "living plant",
          "gloss_text": "living organism with leaves, roots, flowers, water, and sunlight",
          "sense_gloss_bundle": "living plant | botanical organism",
          "all_evidence_text": "living plant | living organism with leaves, roots, flowers, water, and sunlight | botanical organism"
        }
      },
      "shadows": [
        {
          "sense_id": "en-ja:sentence-veto:plant:factory:shadow",
          "target_lemma": "工場",
          "canonical_pos": "noun",
          "evidence_views": {
            "sense_label": "industrial plant",
            "gloss_text": "factory or industrial facility with workers, steel, chemical production, or manufacturing",
            "sense_gloss_bundle": "industrial plant | factory",
            "all_evidence_text": "industrial plant | factory or industrial facility with workers, steel, chemical production, or manufacturing | steel plant | chemical plant"
          }
        }
      ],
      "cases": [
        {
          "case_id": "en-ja:sentence-veto:plant:001",
          "sentence": "She watered the plant on the windowsill.",
          "source_phrase": "plant",
          "gold_winner": "en-ja:sentence-veto:plant:plant:active",
          "gold_decision": "replace",
          "slice_tags": [
            "clear_active",
            "nature"
          ],
          "slice_dimensions": {
            "winner_type": [
              "active"
            ],
            "family": [
              "plant"
            ]
          }
        },
        {
          "case_id": "en-ja:sentence-veto:plant:002",
          "sentence": "The plant needs more sunlight in the afternoon.",